代碼,公司名稱,英文名稱,市場,產業,上市日期,網站,主要產品
"2706","第一店","First Financial Holding","上市","觀光餐旅","1991/06/25","https://twfirsthotel.com.tw","Banking Services; Securities Services; Insurance Products; Asset Management; Wealth Management; Financial Services"
"2707","晶華","Shin Kong Financial Holding","上市","觀光餐旅","1998/03/09","https://www.silkshotelgroup.com","Banking Services; Life Insurance; Securities Services; Asset Management; Wealth Management; Financial Services"
"2712","遠雄來","Far Eastern Department Stores","上市","觀光餐旅","2013/12/03","https://www.farglory-hotel.com.tw","Department Stores; Retail Operations; Shopping Centers; Retail Services; Fashion Retail; Consumer Products"
"2718","全心投控","Quan Xin Tou Kong Holdings","上櫃","建材營造業","2011/03/29","https://www.pleasanthotels.com.tw","Investment Services; Financial Services; Investment Management; Financial Solutions; Asset Management; Investment Holdings"
"2719","燦星旅","","上櫃","觀光餐旅","2012/02/24","https://www.startravel.com.tw","綜合旅遊服務業者,提供國內外旅遊行程規劃、機票訂購、飯店訂房、自由行套裝產品及企業差旅管理等全方位旅遊服務。"
"2722","夏都","Chailease Holding","上市","觀光餐旅","2012/03/14","https://www.chateau-hotels.com.tw","Leasing Services; Auto Financing; Equipment Leasing; Consumer Finance; Factoring Services; Financial Services"
"2723","美食-KY","Mei Shi-KY","上市","觀光餐旅","2010/11/22","https://www.85cafe.com","Food Services; Restaurant Services; Catering; Dining Services; Food & Beverage; Hospitality Services"
"2724","藝舍-KY","藝舍 Co., Ltd.","上櫃","其他業","2012/05/29","https://www.fxhotelsgroup.com","產品製造; 產品銷售; 產品服務; 產品開發; 產品應用; 產品貿易"
"2726","雅茗-KY","Ya Ming-KY","上櫃","觀光餐旅","2014/12/24","https://yummy-town.com","Food Services; Restaurant Services; Catering; Dining Services; Food & Beverage; Hospitality Services"
"2727","王品","Wang Pin","上市","觀光餐旅","2012/03/06","https://www.wowprime.com","Restaurant Services; Food Services; Catering; Dining Services; Food & Beverage; Hospitality Services"
"2729","瓦城","Thai Town","上櫃","觀光餐旅","2012/09/17","https://www.ttfb.com","餐飲服務; 連鎖餐廳; 泰式料理; 餐飲管理"
"2731","雄獅","雄獅 Co., Ltd.","上市","觀光餐旅","2013/09/24","https://www.liontravel.com","餐飲服務; 觀光旅遊; 飯店服務; 餐飲管理; 旅遊服務; 休閒娛樂"
"2732","六角","La Kaffa International","上櫃","觀光餐旅","2015/01/20","https://www.lakaffagroup.com","Restaurant Chain; Bubble Tea; Food & Beverage; Franchise Services; Catering; Restaurant Management"
"2734","易飛網","EZfly (Yi Fei Wang)","上櫃","觀光餐旅","2013/12/26","https://www.ezfly.com","Travel Services; Tourism; Travel Agency; Tour Services; Travel Solutions; Tourism Management"
"2736","富野","Hoya Resort Hotel","上櫃","觀光餐旅","2016/01/06","https://www.hoyaresort.com.tw","飯店經營; 觀光旅遊; 餐飲服務; 會議場地"
"2739","寒舍","寒舍 Co., Ltd.","上市","觀光餐旅","2016/05/19","https://www.mhh-group.com","餐飲服務; 觀光旅遊; 飯店服務; 餐飲管理; 旅遊服務; 休閒娛樂"
"2740","天蔥","Tian Cong Restaurant","上櫃","觀光餐旅","2015/12/24","https://www.mr-onion.com","Restaurant Services; Food Services; Catering; Dining Services; Food & Beverage; Hospitality Services"
"2743","山富","Sun Fu Travel","上櫃","觀光餐旅","2020/03/09","https://www.travel4u.com.tw","Travel Services; Tourism; Travel Agency; Tour Services; Travel Solutions; Tourism Management"
"2745","五福","Wu Fu Travel","上櫃","觀光餐旅","2018/04/16","https://www.lifetour.com.tw","Travel Services; Tourism; Travel Agency; Tour Services; Travel Solutions; Tourism Management"
"2748","雲品","雲品 Co., Ltd.","上市","觀光餐旅","2016/11/23","https://www.fdc-i.com","餐飲服務; 觀光旅遊; 飯店服務; 餐飲管理; 旅遊服務; 休閒娛樂"
"2751","王座","王座 Co., Ltd.","上櫃","觀光餐旅","2024/09/10","https://www.kingza.com.tw","餐飲服務; 觀光旅遊; 飯店服務; 餐飲管理; 旅遊服務; 休閒娛樂"
"2752","豆府","Dou Fu","上櫃","觀光餐旅","2019/09/25","https://www.dubuhouse.com.tw","Restaurant Services; Food Services; Catering; Dining Services; Food & Beverage; Hospitality Services"
"2753","八方雲集","八方雲集 Co., Ltd.","上市","觀光餐旅","2021/09/09","https://www.8way.com.tw","餐飲服務; 觀光旅遊; 飯店服務; 餐飲管理; 旅遊服務; 休閒娛樂"
"2754","亞洲藏壽司","亞洲藏壽司 Co., Ltd.","上櫃","觀光餐旅","2020/09/17","https://www.kurasushi.tw","餐飲服務; 觀光旅遊; 飯店服務; 餐飲管理; 旅遊服務; 休閒娛樂"
"2755","揚秦","Yang Chin","上櫃","觀光餐旅","2020/12/16","https://www.youngqin.com.tw","觀光; 餐飲; 旅館"
"2756","聯發國際","Lian Fa Guoji International","上櫃","觀光餐旅","2022/01/14","https://www.1992lianfa.com","Trading Services; International Trade; Import Export; Trading Solutions; Trade Services; International Business"
"2762","世界健身-KY","World Gym Taiwan","上市","運動休閒","2024/01/24","https://investor.worldgymtaiwan.com","Fitness Services; Gym Facilities; Personal Training; Group Classes; Health Programs; Wellness Services"
"2801","彰銀","Chang Hwa Commercial Bank","上市","金融保險業","1962/02/15","https://www.bankchb.com","Banking Services; Loans; Deposits; Wealth Management; Corporate Banking; Digital Banking"
"2812","台中銀","Taiwan Cooperative Bank","上市","金融保險業","1984/05/15","https://www.tcbbank.com.tw","Banking Services; Loans; Deposits; Wealth Management; Agricultural Finance; Cooperative Banking"
"2816","旺旺保","Hsinchu International Bank","上市","金融保險業","1992/05/05","https://www.wwunion.com","Banking Services; Loans; Deposits; Wealth Management; Corporate Banking; Digital Banking"
"2820","華票","Hua Nan Commercial Bank","上市","金融保險業","1994/10/26","https://www.cbf.com.tw","Banking Services; Loans; Deposits; Wealth Management; Corporate Banking; International Banking"
"2832","台產","Taipei Fubon Commercial Bank","上市","金融保險業","1997/09/30","https://www.tfmi.com.tw","Banking Services; Loans; Deposits; Wealth Management; Corporate Banking; Digital Banking"
"2834","臺企銀","Taiwan Business Bank","上市","金融保險業","1998/01/03","https://www.tbb.com.tw","Banking Services; SME Financing; Loans; Deposits; Corporate Banking; Business Banking"
"2836","高雄銀","Bank of Kaohsiung","上市","金融保險業","1998/05/18","https://www.bok.com.tw","Banking Services; Loans; Deposits; Wealth Management; Corporate Banking; Regional Banking"
"2838","聯邦銀","Union Bank of Taiwan","上市","金融保險業","1998/06/29","https://www.ubot.com.tw","Banking Services; Loans; Deposits; Wealth Management; Corporate Banking; Digital Banking"
"2845","遠東銀","Far EasTone Telecommunications","上市","金融保險業","1998/11/27","https://www.feib.com.tw","Mobile Services; Telecommunications; 5G Networks; Broadband Internet; Cloud Services; ICT Solutions"
"2849","安泰銀","Ane Shin Insurance Brokers","上市","金融保險業","1999/09/27","https://www.entiebank.com.tw","Insurance Brokerage; Risk Management; Insurance Consulting; Employee Benefits; Insurance Services; Brokerage Services"
"2850","新產","Shin Kong Security","上市","金融保險業","2000/05/22","https://www.skinsurance.com.tw","Security Services; Electronic Security; Monitoring Services; Security Systems; Facility Management; Safety Solutions"
"2851","中再保","Central Reinsurance","上市","金融保險業","2000/07/06","https://www.centralre.com","Reinsurance Services; Property Reinsurance; Casualty Reinsurance; Life Reinsurance; Risk Management; Reinsurance Solutions"
"2852","第一保","First Insurance","上市","金融保險業","2000/11/28","https://www.firstins.com.tw","Property Insurance; Casualty Insurance; Auto Insurance; Commercial Insurance; Personal Insurance; Insurance Services"
"2855","統一證","Tong Yang Life Insurance","上市","金融保險業","2002/09/16","https://www.pscnet.com.tw","Life Insurance; Health Insurance; Investment Products; Annuities; Insurance Services; Financial Planning"
"2867","三商壽","San Shin Insurance Brokers","上市","金融保險業","2012/12/18","https://www.mli.com.tw/sites/mliportal/home","Insurance Brokerage; Risk Management; Insurance Consulting; Employee Benefits; Insurance Services; Brokerage Services"
"2880","華南金","Hua Nan Financial Holdings","上市","金融保險業","2001/12/19","https://www.hnfhc.com.tw","Banking Services; Securities Services; Insurance Products; Asset Management; Wealth Management; Financial Services"
"2881","富邦金","Fubon Financial Holding","上市","金融保險業","2001/12/19","https://www.fubon.com","Banking Services; Life Insurance; Property Insurance; Securities Services; Asset Management; Financial Services"
"2882","國泰金","Cathay Financial Holding","上市","金融保險業","2001/12/31","https://www.cathayholdings.com","Banking Services; Life Insurance; Property Insurance; Securities Services; Asset Management; Financial Services"
"2883","凱基金","China Development Financial Holding","上市","金融保險業","2001/12/28","https://www.kgi.com/zh-tw","Banking Services; Securities Services; Venture Capital; Asset Management; Financial Services; Investment Banking"
"2884","玉山金","E.Sun Financial Holding","上市","金融保險業","2002/01/28","https://www.esunfhc.com","Banking Services; Securities Services; Venture Capital; Asset Management; Wealth Management; Financial Services"
"2885","元大金","Yuanta Financial Holding","上市","金融保險業","2002/02/04","https://www.yuanta.com","Banking Services; Securities Services; Asset Management; Futures Trading; Wealth Management; Financial Services"
"2886","兆豐金","Mega Financial Holding","上市","金融保險業","2002/02/04","https://www.megaholdings.com.tw","Banking Services; Securities Services; Insurance Products; Asset Management; Wealth Management; Financial Services"
"2887","台新新光金","Taishin Financial Holding","上市","金融保險業","2002/02/18","https://www.tsholdings.com.tw/tsh","Banking Services; Securities Services; Insurance Products; Asset Management; Credit Cards; Financial Services"
"2889","國票金","Kuo Hua Life Insurance","上市","金融保險業","2002/03/26","https://www.ibf.com.tw","Life Insurance; Health Insurance; Investment Products; Annuities; Insurance Services; Financial Planning"
"2890","永豐金","Sinopac Financial Holdings","上市","金融保險業","2002/05/09","https://www.sinopac.com","Banking Services; Securities Services; Asset Management; Venture Capital; Wealth Management; Financial Services"
"2891","中信金","CTBC Financial Holding","上市","金融保險業","2002/05/17","https://www.ctbcholding.com","Banking Services; Life Insurance; Securities Services; Asset Management; Wealth Management; Financial Services"
"2892","第一金","First Financial Holding","上市","金融保險業","2003/01/02","https://www.firstholding.com.tw","Banking Services; Securities Services; Insurance Products; Asset Management; Wealth Management; Financial Services"
"2897","王道銀行","Wang Dao Bank","上市","金融保險業","2017/05/05","https://www.o-bank.com","Digital Banking; Online Banking; Loans; Deposits; Wealth Management; Banking Services"
"2901","欣欣","Shin Kong Textile","上市","貿易百貨業","1976/05/07","https://www.shinshinltd.com.tw","Polyester Fibers; Nylon Fibers; Textile Materials; Industrial Fibers; Specialty Fibers; Yarn Products"
"2903","遠百","Far Eastern Department Stores","上市","貿易百貨業","1978/10/11","https://www.feds.com.tw","Department Stores; Retail Operations; Shopping Centers; Fashion Retail; Consumer Products; Retail Services"
"2904","匯僑","Mercuries & Associates","上市","其他業","1983/01/05","https://www.pocs.com.tw","Retail Operations; Department Stores; Consumer Products; Trading Services; Distribution Services; Retail Management"
"2905","三商","San Fang Chemical","上市","貿易百貨業","1988/09/19","https://www.mercuries.com.tw","Specialty Chemicals; Electronic Chemicals; Photoresists; Cleaning Chemicals; Semiconductor Materials; Display Materials"
"2906","高林","Goldsun Development & Construction","上市","貿易百貨業","1989/12/26","https://www.collins.com.tw","Real Estate Development; Residential Construction; Commercial Buildings; Construction Services; Property Management; Urban Development"
"2908","特力","Te Pu Construction","上市","貿易百貨業","1993/02/18","https://www.testritegroup.com","Residential Construction; Commercial Buildings; Real Estate Development; Construction Services; Property Management; Building Projects"
"2910","統領","Tong Yang Industry","上市","貿易百貨業","1996/12/30","https://www.tonlin.com.tw","Cement Products; Ready-Mix Concrete; Building Materials; Precast Concrete; Construction Materials; Specialty Cement"
"2911","麗嬰房","Makalot Industrial","上市","貿易百貨業","1997/01/18","https://www.enphants.com","Apparel Manufacturing; Garment Production; Fashion Products; Textile Manufacturing; ODM Services; Clothing Production"
"2912","統一超","Uni-President Enterprises","上市","貿易百貨業","1997/08/22","https://www.7-11.com.tw","Food Products; Beverages; Instant Noodles; Dairy Products; Snack Foods; Convenience Store"
"2913","農林","Nan Liu Enterprise","上市","貿易百貨業","1962/02/09","https://www.ttch.com.tw","Retail Operations; Department Stores; Shopping Centers; Consumer Products; Retail Services; Fashion Retail"
"2915","潤泰全","Ruentex Industries","上市","貿易百貨業","1977/07/20","https://www.ruentex.com.tw","Textile Products; Apparel Manufacturing; Fabric Materials; Retail Operations; Department Stores; Fashion Products"
"2916","滿心","Man Xin Home Living","上櫃","居家生活","2005/03/10","https://www.munsin.com.tw","Home Products; Living Products; Household Items; Home Accessories; Lifestyle Products; Home Furnishings"
"2923","鼎固-KY","Rebar Asia Pacific","上市","建材營造業","2012/12/07","https://www.sinohorizon.tw","Real Estate Development; Construction Services; Property Management; Urban Development; Building Projects; Real Estate Investment"
"2924","宏太-KY","Kindom Development","上櫃","居家生活","2011/12/02","https://www.piyopiyo.com.tw","Real Estate Development; Residential Projects; Commercial Buildings; Construction Services; Property Management; Urban Development"
"2926","誠品生活","Yuanta Securities","上櫃","文化創意業","2013/01/30","https://www.eslitespectrum.com","Securities Brokerage; Investment Banking; Asset Management; Trading Services; Wealth Management; Financial Services"
"2929","淘帝-KY","Hung Ching Development","上市","貿易百貨業","2013/12/30","https://www.topbi.com.tw","Real Estate Development; Residential Construction; Commercial Buildings; Construction Services; Property Management; Urban Development"
"2937","集雅社","Ji Ya She","上櫃","居家生活","2017/06/08","https://www.gseven.com.tw","Cultural Products; Art Services; Cultural Services; Creative Products; Art Solutions; Cultural Management"
"2939","永邑-KY","Kindom Development","上市","貿易百貨業","2018/01/11","https://www.vitafoss.com","Real Estate Development; Residential Projects; Commercial Buildings; Construction Services; Property Management; Urban Development"
"2941","米斯特","Mister Donut (Mi Si Te)","上櫃","居家生活","2024/03/20","https://www.mister.com.tw","Food Services; Restaurant Services; Bakery Products; Food & Beverage; Dining Services; Hospitality Services"
"2945","三商家購","San Shang Jia Gou Home Shopping","上市","貿易百貨業","2021/11/30","https://www.simplemartretail.com","Retail Services; Home Shopping; E-commerce; Retail Solutions; Shopping Services; Retail Management"
"2947","振宇五金","JYH","上櫃","居家生活","2021/10/06","https://www.ald.com.tw","五金製品; 家居用品; 生活用品"
"2948","寶陞","Bao Sheng Home Products","上櫃","居家生活","2023/12/12","https://www.bausen.com","Home Products; Living Products; Household Items; Home Accessories; Lifestyle Products; Home Furnishings"
"2949","欣新網","Xin Xin Wang Network","上櫃","數位雲端","2023/12/15","https://www.hhgalaxy.com","Network Services; Internet Services; Digital Services; Network Solutions; Internet Technology; Digital Solutions"
"3002","歐格","Ou Yang Construction","上市","電腦及週邊設備業","2002/01/23","https://www.ahoku.com.tw","Residential Construction; Commercial Buildings; Real Estate Development; Construction Services; Property Management; Building Projects"
"3003","健和興","Chien Kuo Construction","上市","電子零組件業","2002/02/19","https://ksterminals.com","Residential Construction; Commercial Buildings; Real Estate Development; Construction Services; Property Management; Building Projects"
"3004","豐達科","Bean Food","上市","鋼鐵工業","2002/02/25","https://www.nafco.com.tw","Soy Products; Tofu Products; Soy Milk; Food Manufacturing; Processed Foods; Vegetarian Products"
"3005","神基","Shen Mao Holdings","上市","電腦及週邊設備業","2002/02/25","https://en.getacgroup.com","Electronic Materials; Solder Products; Flux Products; PCB Materials; Soldering Solutions; Electronic Chemicals"
"3006","晶豪科","Chroma ATE","上市","半導體業","2002/03/04","https://www.esmt.com.tw","Test Equipment; Power Supplies; Electronic Loads; Automated Test Systems; Battery Testing; Measurement Instruments"
"3008","大立光","Daxin Materials","上市","光電業","2002/03/11","https://www.largan.com.tw","Copper Foil; Electrolytic Copper Foil; PCB Materials; Battery Foil; Electronic Materials; Specialty Foils"
"3010","華立","Hua Eng Wire & Cable","上市","電子通路業","2002/07/22","https://www.wahlee.com","Power Cables; Communication Cables; Wire Products; Cable Assemblies; Industrial Cables; Specialty Cables"
"3011","今皓","Jin Bao Electronics","上市","電子零組件業","2002/07/22","https://www.jh.com.tw","Connectors; Cable Assemblies; Electronic Components; Precision Connectors; Automotive Connectors; Industrial Connectors"
"3013","晟銘電","Chenbro Micom","上市","電腦及週邊設備業","2002/09/16","https://www.uneec.com","Server Chassis; Rackmount Systems; Storage Chassis; AI Server Solutions; Cloud Computing Chassis; Industrial Chassis"
"3014","聯陽","Lian Hwa Foods","上市","半導體業","2002/10/29","https://www.ite.com.tw","Edible Oils; Food Products; Cooking Oils; Food Ingredients; Processed Foods; Consumer Products"
"3015","全漢","Chun Yuan Steel Industry","上市","電子零組件業","2002/10/16","https://www.fsp-group.com.tw","Steel Products; Steel Bars; Wire Rods; Construction Steel; Industrial Steel; Steel Manufacturing"
"3016","嘉晶","Jia Lih Development","上市","半導體業","2002/12/24","https://www.epi.episil.com","Real Estate Development; Residential Projects; Commercial Buildings; Construction Services; Property Management; Urban Development"
"3017","奇鋐","Ou Yang Construction","上市","電腦及週邊設備業","2002/09/27","https://www.avc.co","Residential Construction; Commercial Buildings; Real Estate Development; Construction Services; Property Management; Building Projects"
"3018","隆銘綠能","Tong Yang Industry","上市","其他電子業","2002/08/26","https://www.tkte.com.tw","Cement Products; Ready-Mix Concrete; Building Materials; Precast Concrete; Construction Materials; Specialty Cement"
"3019","亞光","Asia Cement","上市","光電業","2002/08/26","https://www.asia-optical.com","Cement Products; Ready-Mix Concrete; Building Materials; Cement Manufacturing; Construction Materials; Concrete Products"
"3021","鴻名","Tripod Technology","上市","電子零組件業","2002/08/26","https://www.welltend.com.tw","Printed Circuit Boards; HDI PCBs; IC Substrates; Flexible PCBs; Automotive PCBs; High-frequency PCBs"
"3022","威強電","IEI Integration","上市","電腦及週邊設備業","2002/08/26","https://www.ieiworld.com","Industrial Computers; Embedded Systems; Medical Computing; Network Appliances; AI Accelerators; Panel PCs"
"3023","信邦","Sinyi Realty","上市","電子零組件業","2002/08/26","https://www.sinbon.com","Real Estate Brokerage; Property Services; Real Estate Agency; Property Management; Real Estate Consulting; Transaction Services"
"3024","憶聲","Hung Poo Real Estate","上市","光電業","2002/08/26","https://www.action.com.tw","Real Estate Development; Residential Projects; Commercial Buildings; Construction Services; Property Sales; Urban Development"
"3025","星通","Startek Engineering","上市","通信網路業","2002/08/26","https://www.looptelecom.com","Semiconductor Equipment; Automation Systems; Clean Room Equipment; Factory Automation; Material Handling; Engineering Services"
"3026","禾伸堂","Yu Lon Motor","上市","電子零組件業","2002/08/26","https://www.holystone.com.tw","Passenger Vehicles; Commercial Vehicles; Automotive Parts; Vehicle Assembly; After-sales Service; Vehicle Distribution"
"3027","盛達","盛達 Co., Ltd.","上市","通信網路業","2002/08/26","https://www.billion.com","網路設備; 通訊產品; 網路系統; 通訊模組; 網路通訊; 通訊設備"
"3028","增你強","Zencher","上市","電子通路業","2002/08/26","https://www.zenitron.com.tw","電子零組件; 電子通路; 電子產品"
"3029","零壹","零壹 Co., Ltd.","上市","資訊服務業","2002/08/26","https://www.zerone.com.tw","資訊服務; 軟體開發; 系統整合; IT顧問; 資訊系統; 技術服務"
"3030","德律","De Lu Technology","上市","其他電子業","2002/10/29","https://www.tri.com.tw","Testing Equipment; Measurement Systems; Electronic Testing; Test Solutions; Quality Control; Testing Technology"
"3031","佰鴻","Brightek","上市","光電業","2002/08/26","https://www.brtled.com","LED元件; LED封裝; LED照明; 背光模組; 顯示器背光; LED應用產品"
"3032","偉訓","Wei Xun Technology","上市","電子零組件業","2002/08/26","https://www.hec-group.com.tw","Electronic Products; Electronic Systems; Consumer Electronics; Electronic Components; Industrial Electronics; Electronic Solutions"
"3033","威健","威健 Co., Ltd.","上市","電子通路業","2002/08/26","https://www.weikeng.com.tw","電子零件通路; 電子元件代理; 電子產品銷售; 電子零件; 通路服務; 技術支援"
"3034","聯詠","Novatek Microelectronics Corp.","上市","半導體業","2002/08/26","https://www.novatek.com.tw","LCD驅動IC; OLED驅動IC; 時序控制IC; 觸控IC; SoC晶片"
"3035","智原","","上市","半導體業","2002/08/26","https://www.faraday-tech.com","專業ASIC設計服務公司,提供客製化晶片設計、IP授權及晶片實現服務,主要應用於通訊、消費性電子及車用電子領域。"
"3036","文曄","WT Microelectronics","上市","電子通路業","2002/08/26","https://www.wtmec.com","電子零組件代理; 半導體代理; 電子通路服務; 供應鏈管理"
"3037","欣興","EGIS Technology Inc.","上市","電子零組件業","2002/08/26","https://www.unimicron.com","指紋辨識晶片; 觸控IC; 生物辨識方案"
"3038","全台","全台 Co., Ltd.","上市","光電業","2002/08/26","https://www.edtc.com","光電元件; LED產品; 顯示器; 光學元件; 光電設備; 光電應用"
"3040","遠見","Yuan Jian","上市","其他業","2002/08/26","https://www.gv.com.tw","Electronic Products; Electronic Systems; Consumer Electronics; Electronic Components; Industrial Electronics; Electronic Solutions"
"3041","揚智","","上市","半導體業","2002/08/26","https://www.alitech.com","專業IC設計公司,主要產品為數位電視晶片、機上盒晶片及多媒體處理器,應用於數位家庭娛樂產品。"
"3042","晶技","","上市","電子零組件業","2002/08/26","https://www.txccorp.com","專業石英元件製造商,主要產品為石英晶體、振盪器及頻率元件,應用於通訊設備、電腦及消費性電子產品。"
"3043","科風","科風 Co., Ltd.","上市","其他電子業","2002/08/26","https://www.upspowercom.com","電子產品; 電子製造; 電子設備; 電子系統; 電子應用; 電子服務"
"3044","健鼎","","上市","電子零組件業","2002/08/26","https://www.tripod-tech.com","專業印刷電路板製造商,主要產品為多層板、HDI板及軟硬結合板,應用於智慧型手機、伺服器及車用電子產品。"
"3045","台灣大","Taiwan Mobile Co., Ltd.","上市","通信網路業","2002/08/26","https://www.taiwanmobile.com","行動通訊服務 (4G/5G); 固網寬頻服務; 數位內容服務; 雲端服務; 物聯網解決方案; 企業ICT服務"
"3046","建碁","Jian Qi Technology","上市","電腦及週邊設備業","2002/08/26","https://www.aopen.com","Computer Components; PC Products; Computer Accessories; Peripheral Devices; System Components; Technology Solutions"
"3047","訊舟","訊舟 Co., Ltd.","上市","通信網路業","2002/08/26","https://www.edimax.com/edimax/global","網路設備; 通訊產品; 網路系統; 通訊模組; 網路通訊; 通訊設備"
"3048","益登","Edom (Yi Deng)","上市","電子通路業","2002/10/01","https://www.edomtech.com/tw","Electronic Components; Semiconductor Distribution; Electronic Parts; Component Distribution; Electronic Solutions; Component Supply"
"3049","精金","精金 Co., Ltd.","上市","光電業","2002/09/27","https://www.hannstouch.com","光電元件; LED產品; 顯示器; 光學元件; 光電設備; 光電應用"
